{
  "schema_version": "1.3.0",
  "run_id": "run_demo_patch_001",
  "run_kind": "patch_generation",
  "case_id": null,
  "split": null,
  "lifecycle_state": "queued",
  "input": {
    "input_kind": "patch_generation",
    "failure_cluster_id": "cluster_cash_conversion_001",
    "supporting_failure_ids": [
      "failure_demo_001",
      "failure_demo_002",
      "failure_demo_003"
    ]
  },
  "configuration": {
    "model": {
      "provider": "openai-compatible",
      "model_id": "demo-model",
      "model_snapshot": null,
      "temperature": 0,
      "seed": null,
      "max_output_tokens": 3000,
      "tool_choice_policy": "controlled"
    },
    "workflow": null,
    "skill_version": "1.0.0",
    "skill_hash": "4444444444444444444444444444444444444444444444444444444444444444",
    "formula_version": "1.0.0",
    "prompt_hashes": {
      "optimizer_system": "6666666666666666666666666666666666666666666666666666666666666666"
    },
    "tool_versions": {
      "patch_generator": "1.0.0"
    },
    "dataset_package_id": "package_evolution_demo_001",
    "dataset_package_hash": "7777777777777777777777777777777777777777777777777777777777777777",
    "evidence_cutoff": "2026-08-30T16:00:00+08:00"
  },
  "limits": {
    "timeout_seconds": 300,
    "max_tool_calls": 10,
    "max_total_tokens": 8000,
    "max_estimated_cost": null
  },
  "attempt": 1,
  "idempotency_key": "demo-patch-request-001",
  "created_at": "2026-08-30T16:00:00+08:00",
  "started_at": null,
  "finished_at": null,
  "artifacts": {
    "explicit_plan_id": null,
    "workflow_trace_id": null,
    "tool_record_ids": [],
    "result_id": null,
    "patch_id": null,
    "evaluation_id": null
  },
  "usage": null,
  "failure": null
}
